company_name,website,contact_email,phone,linkedin_url,address,location,niche,relevance_score,status,source,scraped_at
Techasoft,https://techasoft.com,info@techasoft.com,,https://www.linkedin.com/company/techasoft-pvt-ltd,"24, 1st Main Rd, Chandra Reddy Layout, Koramangala 4th Block, Bengaluru, Karnataka 560034","Koramangala, Bangalore, India","Custom software development, mobile apps, web development",10,active,web_search,2026-03-30T13:30:00+00:00
Zerozilla Technologies,https://zerozilla.com,info@zerozilla.com,+91-7349509005,https://www.linkedin.com/company/zerozilla-technologies,"3rd Floor, #35, 11th Main Rd, 5th Block, Jayanagar, Bengaluru, Karnataka 560041","Jayanagar, Bangalore, India","IT consulting, custom app development, cybersecurity, cloud, QA",10,active,web_search,2026-03-30T13:30:00+00:00
Reckonsys Tech Labs,https://reckonsys.com,info@reckonsys.com,,https://www.linkedin.com/company/reckonsys,"Bangalore, India","Bangalore, India","Software product development, MVP builds, enterprise solutions",10,active,web_search,2026-03-30T13:30:00+00:00
Indo-Sakura Software,https://indosakura.com,info.india@indosakura.com,+91-9686391210,https://www.linkedin.com/company/indo-sakura-software,"#32, 1st Cross, 3rd Main, Kanakapura Main Rd, JC Industrial Area, Yeachenahalli, Bengaluru 560062","Yeachenahalli, Bangalore, India","IT consulting, ICT, infrastructure management, Japan-India bridge",9,active,web_search,2026-03-30T13:30:00+00:00
Nextwebi IT Solutions,https://nextwebi.com,ajay@nextwebi.com,+91-9008372466,https://www.linkedin.com/company/nextwebi-it-solutions,"Bangalore, India","Bangalore, India","Web & mobile app development, AI development, cybersecurity, digital marketing",9,active,web_search,2026-03-30T13:30:00+00:00
Pace Wisdom Solutions,https://pacewisdom.com,contact@pacewisdom.com,,https://www.linkedin.com/company/pace-wisdom-solutions,"34/2, 10th Cross, 1st N Block, Rajajinagar, Bengaluru, Karnataka 560010","Rajajinagar, Bangalore, India","AI-driven product engineering, digital transformation, cloud platforms",9,active,web_search,2026-03-30T13:30:00+00:00
Zethic Technologies,https://zethic.com,info@zethic.com,,https://www.linkedin.com/company/zethic-tech,"Vemana Business Incubation Centre, No.1, Mahayogi Vemana Rd, 3rd Block Koramangala, Bengaluru 560034","Koramangala, Bangalore, India","Custom software development, web design, mobile apps, digital marketing",9,active,web_search,2026-03-30T13:30:00+00:00
Banao Technologies,https://banao.tech,hello@banao.tech,+91-9900036467,https://www.linkedin.com/company/banao-tech,"Doddanekkundi, Bangalore, India","Doddanekkundi, Bangalore, India","Web & mobile app development, IT software solutions",8,active,web_search,2026-03-30T13:30:00+00:00
The Scalers,https://thescalers.com,contact@thescalers.com,,https://www.linkedin.com/company/the-scalers,"Bangalore, India","Bangalore, India","Offshore software development teams, tech talent scaling",8,active,web_search,2026-03-30T13:30:00+00:00
Trionova Technology,https://trionova.in,info@trionova.in,+91-9442132694,https://www.linkedin.com/company/trionova-technologies-private-limited,"A701, DNR Casablanca, Maheshwari Nagar, Mahadevapura, Bengaluru 560048","Mahadevapura, Bangalore, India","Custom software development, AI apps, cloud solutions, mobile apps",8,active,web_search,2026-03-30T13:30:00+00:00
Aalpha Information Systems,https://aalpha.net,contact@aalpha.net,,https://www.linkedin.com/company/aalpha-information-systems-india-pvt-ltd,"Bangalore, India","Bangalore, India","IT consulting, bespoke software development, mobile apps, web development",8,active,web_search,2026-03-30T13:30:00+00:00
TechGropse,https://techgropse.com,info@techgropse.com,,https://www.linkedin.com/company/techgropse,"Bangalore, India","Bangalore, India","Mobile app development, web development, AI solutions",8,active,web_search,2026-03-30T13:30:00+00:00
W3 Dream Solutions,https://w3dreamsolutions.com,dinesh@adwestdigital.com,+91-8970772011,https://www.linkedin.com/company/w3-dream-solutions,"No.1375, 1st Floor, 13th Cross, Anjaneyaswamy Temple Rd, JP Nagar 1st Phase, Bengaluru 560078","JP Nagar, Bangalore, India","Custom software development, cybersecurity, IT project management",8,active,web_search,2026-03-30T13:30:00+00:00
Vyshnavi Information Technologies,https://vitinfotech.com,sundareshs@vitinfotech.com,,https://www.linkedin.com/company/vyshnavi-information-technologies,"143, Jigani Bommasandra Link Rd, Electronic City Phase III, Bengaluru 560099","Electronic City, Bangalore, India","IT services, software development, global delivery",7,active,web_search,2026-03-30T13:30:00+00:00
Saina Cloud Software Solutions,https://sainacloud.com,parthasarathyk@sainacloud.com,,,"8th Floor, No.812, Prestige Meridian 1, Mahatma Gandhi Road, Bengaluru 560001","MG Road, Bangalore, India","Microsoft Dynamics 365, Power Platform, Azure AI, ERP integration",7,active,web_search,2026-03-30T13:30:00+00:00
Intrakat Software Systems,https://intraksys.com,info@intraksys.com,,,"702, 6A Cross, 3rd Block, Koramangala, Bengaluru","Koramangala, Bangalore, India","Software development, IT services",7,active,web_search,2026-03-30T13:30:00+00:00
Aguai Solutions,https://aguaisolutions.com,,+91-9880244406,https://www.linkedin.com/company/aguaisolutions,"E 303, Reliaable Acacia, 5th Cross, 7th Main, IBLUR, Sarjapur Outer Ring Road, Bengaluru 560103","Sarjapur, Bangalore, India","Product engineering, web, cloud, mobile, data & AI",7,active,web_search,2026-03-30T13:30:00+00:00
